{
  "$schema": "https://json-schema.org/draft/2020-12/schema",
  "$id": "urn:reviewhub:schemas:studio-to-platform:game-candidate:v1",
  "title": "Offline Studio-to-SEO Platform game proposal (Stage 42 contract draft)",
  "description": "Input candidates only. Never editor-approved or published on import.",
  "type": "object",
  "additionalProperties": false,
  "properties": {
    "contractVersion": {
      "const": 1
    },
    "kind": {
      "const": "seo-platform-candidate-package"
    },
    "packageId": {
      "type": "string",
      "pattern": "^[a-z0-9]+(?:-[a-z0-9]+)*$"
    },
    "revision": {
      "type": "integer",
      "minimum": 1
    },
    "createdAt": {
      "type": "string",
      "format": "date-time",
      "pattern": "^\\d{4}-\\d{2}-\\d{2}T\\d{2}:\\d{2}:\\d{2}(?:\\.\\d{1,3})?Z$"
    },
    "entityType": {
      "const": "game"
    },
    "entityId": {
      "type": "string",
      "pattern": "^[a-z0-9]+(?:-[a-z0-9]+)*$"
    },
    "locale": {
      "const": "en"
    },
    "status": {
      "const": "pending-editorial-review"
    },
    "sampleOnly": {
      "type": "boolean"
    },
    "publicationApproved": {
      "const": false
    },
    "autoPublish": {
      "const": false
    },
    "proposedFacts": {
      "type": "object",
      "additionalProperties": false,
      "properties": {
        "title": {
          "type": "string",
          "minLength": 2,
          "maxLength": 180
        },
        "providerId": {
          "anyOf": [
            {
              "type": "string",
              "pattern": "^[a-z0-9]+(?:-[a-z0-9]+)*$"
            },
            {
              "type": "null"
            }
          ]
        },
        "releaseDate": {
          "anyOf": [
            {
              "type": "string",
              "format": "date",
              "pattern": "^\\d{4}-\\d{2}-\\d{2}$"
            },
            {
              "type": "null"
            }
          ]
        },
        "rtp": {
          "anyOf": [
            {
              "type": "number",
              "minimum": 0,
              "maximum": 100
            },
            {
              "type": "null"
            }
          ]
        },
        "volatility": {
          "enum": [
            null,
            "low",
            "medium",
            "high",
            "very-high"
          ]
        },
        "maxWinMultiplier": {
          "anyOf": [
            {
              "type": "number",
              "exclusiveMinimum": 0
            },
            {
              "type": "null"
            }
          ]
        },
        "reels": {
          "anyOf": [
            {
              "type": "integer",
              "minimum": 1,
              "maximum": 20
            },
            {
              "type": "null"
            }
          ]
        },
        "paylines": {
          "anyOf": [
            {
              "type": "integer",
              "minimum": 1
            },
            {
              "type": "null"
            }
          ]
        },
        "themes": {
          "type": "array",
          "maxItems": 24,
          "uniqueItems": true,
          "items": {
            "type": "string",
            "pattern": "^[a-z0-9]+(?:-[a-z0-9]+)*$"
          }
        },
        "features": {
          "type": "array",
          "maxItems": 24,
          "uniqueItems": true,
          "items": {
            "type": "string",
            "pattern": "^[a-z0-9]+(?:-[a-z0-9]+)*$"
          }
        }
      },
      "required": [
        "title",
        "providerId",
        "releaseDate",
        "rtp",
        "volatility",
        "maxWinMultiplier",
        "reels",
        "paylines",
        "themes",
        "features"
      ]
    },
    "sourceSnapshots": {
      "type": "array",
      "minItems": 1,
      "maxItems": 20,
      "items": {
        "type": "object",
        "additionalProperties": false,
        "properties": {
          "sourceId": {
            "type": "string",
            "pattern": "^[a-z0-9]+(?:-[a-z0-9]+)*$"
          },
          "url": {
            "type": "string",
            "format": "uri",
            "pattern": "^https://",
            "maxLength": 2048
          },
          "observedAt": {
            "type": "string",
            "format": "date-time",
            "pattern": "^\\d{4}-\\d{2}-\\d{2}T\\d{2}:\\d{2}:\\d{2}(?:\\.\\d{1,3})?Z$"
          },
          "sha256": {
            "type": "string",
            "pattern": "^[a-f0-9]{64}$"
          },
          "sourceType": {
            "enum": [
              "primary",
              "secondary",
              "third-party"
            ]
          },
          "rightsStatus": {
            "const": "pending-review"
          }
        },
        "required": [
          "sourceId",
          "url",
          "observedAt",
          "sha256",
          "sourceType",
          "rightsStatus"
        ]
      }
    },
    "claims": {
      "type": "array",
      "minItems": 1,
      "maxItems": 40,
      "items": {
        "type": "object",
        "additionalProperties": false,
        "properties": {
          "field": {
            "enum": [
              "title",
              "providerId",
              "releaseDate",
              "rtp",
              "volatility",
              "maxWinMultiplier",
              "reels",
              "paylines",
              "themes",
              "features"
            ]
          },
          "value": {},
          "sourceIds": {
            "type": "array",
            "minItems": 1,
            "uniqueItems": true,
            "items": {
              "type": "string",
              "pattern": "^[a-z0-9]+(?:-[a-z0-9]+)*$"
            }
          },
          "verificationStatus": {
            "enum": [
              "unverified",
              "conflicted"
            ]
          }
        },
        "required": [
          "field",
          "value",
          "sourceIds",
          "verificationStatus"
        ]
      }
    },
    "editorialBrief": {
      "type": "object",
      "additionalProperties": false,
      "properties": {
        "intent": {
          "type": "string",
          "minLength": 4,
          "maxLength": 140
        },
        "proposedSections": {
          "type": "array",
          "maxItems": 16,
          "uniqueItems": true,
          "items": {
            "type": "string",
            "pattern": "^[a-z0-9]+(?:-[a-z0-9]+)*$"
          }
        },
        "notes": {
          "type": "string",
          "maxLength": 2000
        }
      },
      "required": [
        "intent",
        "proposedSections",
        "notes"
      ]
    },
    "relatedEntityCandidates": {
      "type": "array",
      "maxItems": 12,
      "items": {
        "type": "object",
        "additionalProperties": false,
        "properties": {
          "relation": {
            "const": "related-to-game"
          },
          "targetEntityId": {
            "type": "string",
            "pattern": "^[a-z0-9]+(?:-[a-z0-9]+)*$"
          },
          "reason": {
            "type": "string",
            "minLength": 10,
            "maxLength": 350
          },
          "status": {
            "const": "proposed"
          }
        },
        "required": [
          "relation",
          "targetEntityId",
          "reason",
          "status"
        ]
      }
    }
  },
  "required": [
    "contractVersion",
    "kind",
    "packageId",
    "revision",
    "createdAt",
    "entityType",
    "entityId",
    "locale",
    "status",
    "sampleOnly",
    "publicationApproved",
    "autoPublish",
    "proposedFacts",
    "sourceSnapshots",
    "claims",
    "editorialBrief",
    "relatedEntityCandidates"
  ]
}
